{
  "id": "recon-diff-1",
  "run_id": "recon-run-2026-07-16",
  "diff_type": "CH_MISSING",
  "severity": "critical",
  "dimensions": {
    "application_id": "application-a",
    "granularity": "hour",
    "time_bucket": "2026-07-15T12:00:00.000Z",
    "virtual_model": "text.fast",
    "model_id": "model-a",
    "request_model": "openai-prod-a",
    "provider": "openai",
    "user_id": null
  },
  "pg_values": {
    "event_count": "5",
    "provider_cost": "0.006300000000000000",
    "aiu_micros": "9200000"
  },
  "ch_values": null,
  "delta_values": {
    "event_count": "-5",
    "provider_cost": "-0.006300000000000000",
    "aiu_micros": "-9200000"
  },
  "count": "5",
  "amount": "0.006300000000000000",
  "sample_event_ids": ["01ARZ3NDEKTSV4RRFFQ69G5FAV"],
  "explanation": "PostgreSQL contains official values that are missing from ClickHouse.",
  "status": "open",
  "resolution": null,
  "resolved_by": null,
  "resolved_at": null,
  "created_at": "2026-07-16T01:00:05.000Z"
}
